### ISSUE TITLE
keycloak integration does not work

### ISSUE THREAD

**Issue by 9maf4you** [argoproj/argo-cd#7064]
Checklist:

* [x] I've searched in the docs and FAQ for my answer: https://bit.ly/argocd-faq.
* [x] I've included steps to reproduce the bug.
* [x] I've pasted the output of `argocd version`.

**Describe the bug**
The error `unknown app state IMmdkGyVek` happens when trying to login using keycloak 

**To Reproduce**
1. Setup keycloak and argocd using the manual https://argoproj.github.io/argo-cd/operator-manual/user-management/keycloak/.
2. Choose "Login via keycloak" at a login page 
3. login into keycloak
4. Argocd redirects back to argocd

**Expected behavior**
Expected that user successfully logins on

**Screenshots**
-

**Version**
```argocd: v2.0.4+0842d44
  BuildDate: 2021-06-23T01:27:53Z
  GitCommit: 0842d448107eb1397b251e63ec4d4bc1b4efdd6e
  GitTreeState: clean
  GoVersion: go1.16
  Compiler: gc
  Platform: linux/amd64
```

**Logs**
In traffic dump at kube-node  where `argocd-redis` is run we can see that the key "oidc|IMmdkGyVek|1.8.3"  is set, then the key has been quired, removed and quired again
```
18:21:22.265649 IP 10.149.1.207.40930 > 10.148.240.121.6379: Flags [P.], seq 1603335899:1603336031, ack 2562711736, win 245, options [nop,nop,TS val 90368891 ecr 4239583688], length 132: RESP "set" "oidc|IMmdkGyVek|1.8.3" "{"returnURL":"https://argocd.linx5.k8s.domain.ru/applications"}" "ex" "180"
18:21:22.265783 IP 10.148.240.121.6379 > 10.149.1.207.40930: Flags [P.], seq 1:6, ack 132, win 252, options [nop,nop,TS val 4239602671 ecr 90368891], length 5: RESP "OK"
18:21:22.265899 IP 10.149.1.207.40930 > 10.148.240.121.6379: Flags [.], ack 6, win 245, options [nop,nop,TS val 90368892 ecr 4239602671], length 0
18:21:22.403678 IP 10.149.1.207.40930 > 10.148.240.121.6379: Flags [P.], seq 132:173, ack 6, win 245, options [nop,nop,TS val 90369029 ecr 4239602671], length 41: RESP "get" "oidc|IMmdkGyVek|1.8.3"
18:21:22.403784 IP 10.148.240.121.6379 > 10.149.1.207.40930: Flags [P.], seq 6:80, ack 173, win 252, options [nop,nop,TS val 4239602809 ecr 90369029], length 74: RESP "{"returnURL":"https://argocd.linx5.k8s.domain.ru/applications"}"
18:21:22.403909 IP 10.149.1.207.40930 > 10.148.240.121.6379: Flags [.], ack 80, win 245, options [nop,nop,TS val 90369030 ecr 4239602809], length 0
18:21:22.404019 IP 10.149.1.207.40930 > 10.148.240.121.6379: Flags [P.], seq 173:214, ack 80, win 245, options [nop,nop,TS val 90369030 ecr 4239602809], length 41: RESP "del" "oidc|IMmdkGyVek|1.8.3"
18:21:22.404053 IP 10.148.240.121.6379 > 10.149.1.207.40930: Flags [P.], seq 80:84, ack 214, win 252, options [nop,nop,TS val 4239602809 ecr 90369030], length 4: RESP "1"
18:21:22.444474 IP 10.149.1.207.40930 > 10.148.240.121.6379: Flags [.], ack 84, win 245, options [nop,nop,TS val 90369070 ecr 4239602809], length 0
18:21:22.462044 IP 10.149.1.207.40930 > 10.148.240.121.6379: Flags [P.], seq 214:255, ack 84, win 245, options [nop,nop,TS val 90369088 ecr 4239602809], length 41: RESP "get" "oidc|IMmdkGyVek|1.8.3"
18:21:22.462185 IP 10.148.240.121.6379 > 10.149.1.207.40930: Flags [P.], seq 84:89, ack 255, win 252, options [nop,nop,TS val 4239602867 ecr 90369088], length 5: RESP null
```

**Comment by iam-veeramalla** [comment]
@9maf4you Can you please confirm if this behavior is intermittent ? I have seen people running into this issue and were able to resolve it by choosing a different browser or by just cleaning the cache and cookies.

If this is not intermittent, Do you also see any errors in the Keycloak Pod logs ? If yes, Please share them by masking any secure information.

**Comment by fblgit** [comment]
i have no problem at all with argocd and keycloak

**Comment by iam-veeramalla** [comment]
@wtam2018 @jessesuen @jannfis can you please add #works-for-me label on this ?
